{
  "approval_id": "approval-proposal-m5-20260917-rope-gfx1151-decode-d128-fp16-f5e8fda34c00e49b-approved",
  "candidate_content_hash": "ea202a78725df1b9312ebd2a0c2065ce7865e876442b555abce9e8d6db0f209f",
  "captured_at": "2026-09-17T12:43:12.704999+00:00",
  "correctness": {
    "cases": [
      {
        "case_id": "decode-d128-fp16-seed20260917",
        "finite": true,
        "max_absolute_error": 0.0,
        "runtime_ok": true,
        "seed": 20260917
      },
      {
        "case_id": "decode-d128-fp16-seed20260918",
        "finite": true,
        "max_absolute_error": 0.0,
        "runtime_ok": true,
        "seed": 20260918
      },
      {
        "case_id": "decode-d128-fp16-seed20260919",
        "finite": true,
        "max_absolute_error": 0.0,
        "runtime_ok": true,
        "seed": 20260919
      }
    ],
    "oracle": "torch_fp32_reference",
    "passed": true
  },
  "decision": "promote",
  "environment": {
    "architecture": "gfx1151",
    "python_abi": "cp312",
    "pytorch_version": "2.14.0a0+rocm7.15.0a20260719",
    "rocm_abi": "7.15",
    "wavefront_size": 32
  },
  "evidence_id": "m5-20260917-rope-gfx1151-decode-d128-fp16",
  "guarantee_boundary": "Exact gfx1151, ROCm 7.15, cp312, PyTorch 2.14.0a0+rocm7.15.0a20260719, workload {\"contiguous\": true, \"dtype\": \"fp16\", \"head_dim\": 128, \"kv_heads\": 8, \"mode\": \"split_half\", \"q_heads\": 32, \"requires_grad\": false, \"tokens\": 1}, contiguous inference only.",
  "operator": "rope",
  "schema_version": "1.0",
  "semantic_version": "1.0",
  "source_evidence_hashes": {
    "candidate_source": "da772f6e5539af28202915969aae33264d85c081c3942a5148505a9585657edf",
    "dispatch": "6c966d7c954dac74463a642ddfaa87edc74f7c1ddee6c224b638e4e502205402",
    "evaluation": "635872fd55d3bff190e8ecbb5c8de30a5f46ed7ece6e172730f7ae74cf09bbb4",
    "manifest": "39b2d7fc1fb1d2a8f2ba95a0af8dfec5256ed9861f785d381e374fe0b5e0d3a2"
  },
  "timing": {
    "baseline": "torch_fp32_reference",
    "baseline_cv": 0.005714972078272487,
    "baseline_median_ms": 0.07166193413011956,
    "baseline_samples_ms": [
      0.07339059540719697,
      0.07210051103071732,
      0.07163346724076705,
      0.07171550866329308,
      0.07169040101947206,
      0.07118313876065341,
      0.07160948319868608,
      0.07146852897875237,
      0.07157024961529355,
      0.07202646891276042,
      0.07184842658765388,
      0.07188751683090672,
      0.07107525449810606,
      0.07136133829752604,
      0.0715679746685606,
      0.0714815498120857,
      0.07161222978071732,
      0.07184460264263731,
      0.0714437080152107,
      0.07132050947709517,
      0.07194068215110085,
      0.0718449540571733,
      0.07200986457593513,
      0.07191489017370975,
      0.07162236531575521,
      0.07187351111209754,
      0.07132028290719697,
      0.07115757335316052,
      0.07170687588778409,
      0.07170476740056818
    ],
    "candidate_cv": 0.01305550195797739,
    "candidate_median_ms": 0.007959275968147047,
    "candidate_samples_ms": [
      0.00836591778379498,
      0.007945242217092804,
      0.008031997680664062,
      0.007912442178437205,
      0.008056698423443419,
      0.007894772038315281,
      0.007927851821437026,
      0.007895174315481476,
      0.007948631517814867,
      0.008019563501531428,
      0.00795051401311701,
      0.0079450595740116,
      0.00814488613244259,
      0.007974765084006569,
      0.00806953545772668,
      0.0078773105505741,
      0.007944685040098248,
      0.007979635180849017,
      0.008080853548916904,
      0.008069207162568063,
      0.008121584111993964,
      0.007967928684119023,
      0.007921709002870501,
      0.007903224482680812,
      0.00798004843971946,
      0.007950623252175071,
      0.007908860408898556,
      0.00807859247381037,
      0.008142847003358784,
      0.007867646072850083
    ],
    "confidence_interval_pct": [
      88.79604617751879,
      88.93333667809632
    ],
    "latency_reduction_pct": 88.89330009751752,
    "stable": true
  },
  "workload": {
    "contiguous": true,
    "dtype": "fp16",
    "head_dim": 128,
    "kv_heads": 8,
    "mode": "split_half",
    "q_heads": 32,
    "requires_grad": false,
    "tokens": 1
  }
}
